{
  "$schema": "../../packages/schema/schemas/media-metadata.schema.json",
  "_meta": {
    "fields": {
      "metadata.episode_count": {
        "last_sync": "2026-10-02T09:28:53Z",
        "provider_ref": {
          "entity": "subject",
          "id": "528635",
          "provider": "bangumi"
        },
        "rule": "approved issue contribution",
        "source": "bangumi",
        "source_field": "issue"
      },
      "metadata.runtime": {
        "last_sync": "2026-10-02T09:28:53Z",
        "provider_ref": {
          "entity": "subject",
          "id": "528635",
          "provider": "bangumi"
        },
        "rule": "approved issue contribution",
        "source": "bangumi",
        "source_field": "issue"
      },
      "metadata.title": {
        "last_sync": "2026-10-02T09:28:53Z",
        "provider_ref": {
          "entity": "subject",
          "id": "528635",
          "provider": "bangumi"
        },
        "rule": "approved issue contribution",
        "source": "bangumi",
        "source_field": "issue"
      }
    },
    "last_sync": {
      "bangumi": "2026-10-02T09:28:53Z"
    }
  },
  "media_id": "media-000130",
  "metadata": {
    "episode_count": 0,
    "runtime": 0,
    "title": "クレヨンしんちゃん 超華麗！灼熱のカスカベダンサーズ"
  },
  "schema": "media-metadata/v1"
}
