{
  "$schema": "../../packages/schema/schemas/media-metadata.schema.json",
  "_meta": {
    "fields": {
      "metadata.episode_count": {
        "source": "bangumi",
        "source_field": "eps",
        "last_sync": "2026-08-11T05:45:53.037Z",
        "rule": "bangumi.eps -> metadata.episode_count",
        "provider_ref": {
          "entity": "subject",
          "id": "202661",
          "provider": "bangumi"
        },
        "raw_ref": "raw/bangumi/api/subject-202661.json"
      },
      "metadata.runtime": {
        "last_sync": "2026-07-22T13:04:14Z",
        "provider_ref": {
          "entity": "subject",
          "id": "202661",
          "provider": "bangumi"
        },
        "rule": "approved issue contribution",
        "source": "bangumi",
        "source_field": "issue"
      },
      "metadata.title": {
        "last_sync": "2026-07-22T13:04:14Z",
        "provider_ref": {
          "entity": "subject",
          "id": "202661",
          "provider": "bangumi"
        },
        "rule": "approved issue contribution",
        "source": "bangumi",
        "source_field": "issue"
      }
    },
    "last_sync": {
      "bangumi": "2026-08-11T05:45:53.037Z"
    }
  },
  "media_id": "media-000051",
  "metadata": {
    "episode_count": 293,
    "runtime": 0,
    "title": "BORUTO-ボルト- NARUTO NEXT GENERATIONS"
  },
  "schema": "media-metadata/v1"
}
